{"schema_version":"1.0","activity_id":"L02-A1","lesson":2,"title":"Create a data-shape contract","mission":"Translate prediction evidence into named vector, matrix, and batch shapes another component can consume safely.","estimated_minutes":40,"starting_state":{"entry_point":"lessons/02_vectors_matrices_tensors/index.html#objects","requirements":["Modern web browser","Completed Lesson 1 prediction contract"],"known_good_state":"The object explorer begins with labeled scalar, vector, matrix, and tensor examples.","compose_profile":null},"learner_decisions":["Axis names and units","Valid transformation","Semantic failure case"],"levels":{"guided":{"objective":"Narrate tensor rank, shape, axes, and one dot product.","steps":["Inspect each object rank","Name every axis","Verify the worked dot product"],"expected_observation":"Rank counts axes while shape gives each axis length."},"challenge":{"objective":"Design and test the Phase 1 batch contract.","steps":["Define record and batch axes","Trace one valid transformation","Create and reject a semantic mismatch"],"expected_observation":"Known-row evidence catches an operation that shape compatibility alone permits."},"engineer_extension":{"objective":"Estimate memory and movement implications of dtype and batch choices.","steps":["Calculate element count","Compare float32 and float16 storage","Double batch size and reassess"],"expected_observation":"Storage scales with elements and bytes per value while semantics remain unchanged.","optional":true}},"failure_experiment":{"change":"Apply a compatible three-value vector with the wrong axis meaning.","prediction":"The operation succeeds numerically but corrupts interpretation.","failure_signal":"A known-row result violates the named data contract.","recovery":"Restore the correct axis order, units, and transformation."},"evidence":["Axis table","Shape trace","Known-row calculation","Rejected semantic mismatch"],"artifact":{"name":"Named data-shape contract","format":"markdown","path_or_download":"L02-A1-shape-contract.md","fields":["axes","units","shapes","transformations","rejected_case"]},"acceptance_criteria":["Every axis has a name, ordering rule, and meaning.","A valid transformation is traced from input to output.","A semantically invalid but shape-compatible operation is rejected."],"recovery":["Return to one row before reasoning about the full batch.","Label axes and units before checking numerical compatibility."],"phase_increment":"P1-I02"}
