{"schema_version":"1.0","activity_id":"L07-A1","lesson":7,"title":"Build a forward and backward gradient ledger","mission":"Build a forward and backward gradient ledger using the lesson interactions and accepted prior evidence.","estimated_minutes":45,"starting_state":{"entry_point":"lessons/07_backpropagation_from_scratch/index.html#ai-story","requirements":["Modern web browser","Accepted increment before P2-I02"],"known_good_state":"The lesson interactions load and the prior contract is available.","compose_profile":null},"learner_decisions":["Forward graph","Local derivatives","Gradient telemetry"],"levels":{"guided":{"objective":"Complete the supported activity path and record observable evidence.","steps":["Record forward values","Propagate gradients backward","Add contributions at branches"],"expected_observation":"Every gradient is traceable to the same forward graph."},"challenge":{"objective":"Create a vanishing or exploding path and diagnose its signal.","steps":["Predict the result before changing the scenario","Run the failure comparison","Record evidence and recovery"],"expected_observation":"Gradient magnitude collapses or grows across the path."},"engineer_extension":{"objective":"Specify norms, nonfinite checks, and accumulation telemetry.","steps":["Define the production constraint","Add operational evidence","Document rollback behavior"],"expected_observation":"Telemetry separates absent signal from unstable signal.","optional":true}},"failure_experiment":{"change":"Scale chain derivatives","prediction":"Gradients vanish or explode","failure_signal":"Layer gradient norms cross limits","recovery":"Restore scale and repeat from same state"},"evidence":["Forward trace","Derivative ledger","Branch sum","Failure signal","Recovery"],"artifact":{"name":"Build a forward and backward gradient ledger","format":"markdown","path_or_download":"L07-A1-gradient-ledger.md","fields":["forward_trace","derivative_ledger","branch_sum","failure_signal","recovery"]},"acceptance_criteria":["Every gradient is traceable to the same forward graph.","Gradient magnitude collapses or grows across the path.","The artifact identifies its downstream consumer and recovery behavior."],"recovery":["Restore scale and repeat from same state","Return to the lesson's known-good scenario before comparing another change."],"phase_increment":"P2-I02"}
