{"schema_version":"1.0","activity_id":"L10-A1","lesson":10,"title":"Write an evidence-based generalization plan","mission":"Write an evidence-based generalization plan using the lesson interactions and accepted prior evidence.","estimated_minutes":45,"starting_state":{"entry_point":"lessons/10_regularization_and_generalization/index.html#ai-story","requirements":["Modern web browser","Accepted increment before P2-I05"],"known_good_state":"The lesson interactions load and the prior contract is available.","compose_profile":null},"learner_decisions":["Curve diagnosis","Control assumption","Rollback criterion"],"levels":{"guided":{"objective":"Complete the supported activity path and record observable evidence.","steps":["Diagnose fit from curves","Choose one targeted control","Define success and failure"],"expected_observation":"The control responds to observed evidence rather than habit."},"challenge":{"objective":"Compare two controls under fixed evaluation boundaries.","steps":["Predict the result before changing the scenario","Run the failure comparison","Record evidence and recovery"],"expected_observation":"Only the control matching the failure improves held-out evidence."},"engineer_extension":{"objective":"Add shift monitoring, slices, and seed uncertainty.","steps":["Define the production constraint","Add operational evidence","Document rollback behavior"],"expected_observation":"Release evidence covers robustness and change.","optional":true}},"failure_experiment":{"change":"Apply invalid augmentation","prediction":"Labels no longer preserve meaning","failure_signal":"Validation degrades on the intended task","recovery":"Remove transformation and restore baseline"},"evidence":["Diagnosis","Selected control","Assumption","Experiment","Slice results","Recommendation"],"artifact":{"name":"Write an evidence-based generalization plan","format":"markdown","path_or_download":"L10-A1-model-evidence-card.md","fields":["diagnosis","selected_control","assumption","experiment","slice_results","recommendation"]},"acceptance_criteria":["The control responds to observed evidence rather than habit.","Only the control matching the failure improves held-out evidence.","The artifact identifies its downstream consumer and recovery behavior."],"recovery":["Remove transformation and restore baseline","Return to the lesson's known-good scenario before comparing another change."],"phase_increment":"P2-I05"}
