{"schema_version":"1.0","activity_id":"L01-A1","lesson":1,"title":"Build the first model evidence record","mission":"Produce a reproducible comparison showing how evidence quality and training controls change a learned line.","estimated_minutes":35,"starting_state":{"entry_point":"lessons/01_linear_regression/index.html#lab","requirements":["Modern web browser"],"known_good_state":"Default controls produce a stable line near the hidden linear relationship.","compose_profile":null},"learner_decisions":["Which single control to change","Which evidence identifies failure","How to explain recovery"],"levels":{"guided":{"objective":"Run and interpret the known-good baseline.","steps":["Run default training","Record parameters and losses","Compare the line with the evidence"],"expected_observation":"Weight approaches the hidden relationship and test loss remains finite."},"challenge":{"objective":"Produce and diagnose three distinct failure conditions.","steps":["Change one control at a time","Record slow, unstable, and data-quality runs","Restore the baseline"],"expected_observation":"Each controlled change produces a distinct visible diagnosis."},"engineer_extension":{"objective":"Compare iterative fitting with a direct least-squares reference.","steps":["Complete Engineering Lab A","Calculate both solutions under identical data","Explain numerical differences"],"expected_observation":"Both methods agree within an explicitly selected tolerance.","optional":true}},"failure_experiment":{"change":"Increase learning rate until updates diverge.","prediction":"Loss grows and the line moves farther from useful evidence.","failure_signal":"The interface reports instability and non-improving loss.","recovery":"Restore the documented default learning rate and rerun."},"evidence":["Recorded controls","Weight and bias","Training and test loss","Failure diagnosis"],"artifact":{"name":"Model evidence record","format":"markdown","path_or_download":"L01-A1-model-evidence.md","fields":["hypothesis","controls","observations","interpretation","recovery"]},"acceptance_criteria":["A normal run and failed run are reproducible from recorded settings.","Training and test results are reported separately.","The explanation distinguishes parameters from experiment controls."],"recovery":["Use Reset defaults before comparing runs.","Change only one control between recorded experiments."],"phase_increment":"P1-I01"}
