{"schema_version":"1.0","activity_id":"L06-A1","lesson":6,"title":"Create a neural-network architecture card","mission":"Create a neural-network architecture card using the lesson interactions and accepted prior evidence.","estimated_minutes":45,"starting_state":{"entry_point":"lessons/06_neural_network_anatomy/index.html#ai-story","requirements":["Modern web browser","Accepted increment before P2-I01"],"known_good_state":"The lesson interactions load and the prior contract is available.","compose_profile":null},"learner_decisions":["Layer widths","Activation choice","Output semantics"],"levels":{"guided":{"objective":"Complete the supported activity path and record observable evidence.","steps":["Choose the layer sequence","Trace each shape","Count weights and biases"],"expected_observation":"Shapes compose and the output matches the task."},"challenge":{"objective":"Remove nonlinearity and predict the representational consequence.","steps":["Predict the result before changing the scenario","Run the failure comparison","Record evidence and recovery"],"expected_observation":"Stacked linear layers remain one linear transformation."},"engineer_extension":{"objective":"Estimate compute and propose a smaller compatible design.","steps":["Define the production constraint","Add operational evidence","Document rollback behavior"],"expected_observation":"A smaller design preserves interfaces with lower cost.","optional":true}},"failure_experiment":{"change":"Remove activation","prediction":"Model loses nonlinear boundaries","failure_signal":"Different inputs remain linearly separable only","recovery":"Restore activation and verify shape trace"},"evidence":["Layer table","Shape trace","Parameter count","Output semantics","Assumptions"],"artifact":{"name":"Create a neural-network architecture card","format":"markdown","path_or_download":"L06-A1-architecture-card.md","fields":["layer_table","shape_trace","parameter_count","output_semantics","assumptions"]},"acceptance_criteria":["Shapes compose and the output matches the task.","Stacked linear layers remain one linear transformation.","The artifact identifies its downstream consumer and recovery behavior."],"recovery":["Restore activation and verify shape trace","Return to the lesson's known-good scenario before comparing another change."],"phase_increment":"P2-I01"}
