{"schema_version":"1.0","activity_id":"L05-A1","lesson":5,"title":"Defend the integrated Phase 1 release recommendation","mission":"Defend the integrated Phase 1 release recommendation using the lesson interactions and accepted prior evidence.","estimated_minutes":45,"starting_state":{"entry_point":"lessons/05_regression_and_classification/index.html#ai-story","requirements":["Modern web browser","Accepted increment before P1-I05"],"known_good_state":"The lesson interactions load and the prior contract is available.","compose_profile":null},"learner_decisions":["Target and action","Metric and threshold","Production-shaped split"],"levels":{"guided":{"objective":"Complete the supported activity path and record observable evidence.","steps":["Define target, baseline, and valid features","Select metric and threshold","Protect the final test"],"expected_observation":"The decision connects prediction quality to an operational action."},"challenge":{"objective":"Reject leakage and compare asymmetric error costs.","steps":["Predict the result before changing the scenario","Run the failure comparison","Record evidence and recovery"],"expected_observation":"Leakage improves apparent metrics without valid deployment evidence."},"engineer_extension":{"objective":"Add drift, slice, calibration, and rollback gates.","steps":["Define the production constraint","Add operational evidence","Document rollback behavior"],"expected_observation":"The release packet states when not to ship.","optional":true}},"failure_experiment":{"change":"Leaking feature","prediction":"Validation score rises unrealistically","failure_signal":"Feature exists only after prediction time","recovery":"Remove feature and repeat frozen evaluation"},"evidence":["Target","Baseline","Rejected leakage","Metric","Threshold","Split","Decision"],"artifact":{"name":"Defend the integrated Phase 1 release recommendation","format":"markdown","path_or_download":"L05-A1-phase1-decision-report.md","fields":["target","baseline","rejected_leakage","metric","threshold","split","decision"]},"acceptance_criteria":["The decision connects prediction quality to an operational action.","Leakage improves apparent metrics without valid deployment evidence.","The artifact identifies its downstream consumer and recovery behavior."],"recovery":["Remove feature and repeat frozen evaluation","Return to the lesson's known-good scenario before comparing another change."],"phase_increment":"P1-I05"}
