{"schema_version":"1.0","activity_id":"L03-A1","lesson":3,"title":"Write and stress-test an optimization contract","mission":"Choose a loss and update policy for the Phase 1 prediction problem and demonstrate useful and failed training behavior.","estimated_minutes":45,"starting_state":{"entry_point":"lessons/03_loss_functions_and_optimization/index.html#losses","requirements":["Modern web browser","Lesson 2 shape contract"],"known_good_state":"The supported rate follows the displayed loss toward its minimum.","compose_profile":null},"learner_decisions":["Loss aligned to error cost","Batch interpretation","Learning-rate failure threshold"],"levels":{"guided":{"objective":"Trace loss, gradient, and one supported update.","steps":["Compare MAE and MSE","Inspect local slope","Run the supported learning rate"],"expected_observation":"The update moves opposite the gradient and reduces the displayed loss."},"challenge":{"objective":"Define an evidence-backed optimization policy.","steps":["Select a loss from error cost","Produce slow and unstable trajectories","Define failure telemetry and recovery"],"expected_observation":"Different rates create distinguishable convergence and failure patterns."},"engineer_extension":{"objective":"Compare optimizer state and convergence under a fixed budget.","steps":["Complete Engineering Lab A","Run gradient descent and an adaptive optimizer","Report convergence and state tradeoffs"],"expected_observation":"Optimizer choice changes trajectory and checkpoint state without replacing evaluation evidence.","optional":true}},"failure_experiment":{"change":"Select the divergent learning rate.","prediction":"Overshoots grow rather than settle.","failure_signal":"Loss and parameter magnitude increase across updates.","recovery":"Reduce the rate, reset state, and rerun from the same initialization."},"evidence":["Loss rationale","Gradient trace","Rate trajectories","Failure threshold","Recovery run"],"artifact":{"name":"Optimization contract","format":"markdown","path_or_download":"L03-A1-optimization-contract.md","fields":["loss","evaluation_metrics","batch_policy","learning_rate","failure_signal","recovery"]},"acceptance_criteria":["Loss choice is justified from operational error cost.","Stable and unstable runs are reproducible.","Optimization telemetry is distinct from release evaluation."],"recovery":["Reset optimizer state before comparing rates.","Use the same starting weight and step budget across runs."],"phase_increment":"P1-I03"}
