{"schema_version":"1.0","activity_id":"L04-A1","lesson":4,"title":"Create an uncertainty and sampling record","mission":"Create an uncertainty and sampling record using the lesson interactions and accepted prior evidence.","estimated_minutes":45,"starting_state":{"entry_point":"lessons/04_probability_and_statistics_for_ml/index.html#ai-story","requirements":["Modern web browser","Accepted prior lesson increments"],"known_good_state":"The lesson interactions load and the prior contract is available.","compose_profile":null},"learner_decisions":["Population and sample","Interval assumptions","Calibration and bias checks"],"levels":{"guided":{"objective":"Complete the supported activity path and record observable evidence.","steps":["Name population, sample, and base rate","Choose an interval and calibration check","Record one bias risk"],"expected_observation":"The record distinguishes population uncertainty from sample evidence."},"challenge":{"objective":"Stress-test a biased sample and explain the misleading conclusion.","steps":["Predict the result before changing the scenario","Run the failure comparison","Record evidence and recovery"],"expected_observation":"The bias produces confident but invalid evidence."},"engineer_extension":{"objective":"Design slice monitoring and delayed-label recovery.","steps":["Define the production constraint","Add operational evidence","Document rollback behavior"],"expected_observation":"Operational slices expose drift hidden by an aggregate.","optional":true}},"failure_experiment":{"change":"Biased sample","prediction":"Narrow but wrong estimate","failure_signal":"Coverage or slice failure","recovery":"Revise collection and rerun evaluation"},"evidence":["Population definition","Sample definition","Base rate","Interval","Calibration check","Bias recovery"],"artifact":{"name":"Create an uncertainty and sampling record","format":"markdown","path_or_download":"L04-A1-uncertainty-record.md","fields":["population_definition","sample_definition","base_rate","interval","calibration_check","bias_recovery"]},"acceptance_criteria":["The record distinguishes population uncertainty from sample evidence.","The bias produces confident but invalid evidence.","The artifact identifies its downstream consumer and recovery behavior."],"recovery":["Revise collection and rerun evaluation","Return to the lesson's known-good scenario before comparing another change."],"phase_increment":"P1-I04"}
