{"schema_version":"1.0","activity_id":"L09-A1","lesson":9,"title":"Create a reproducible model release packet","mission":"Create a reproducible model release packet using the lesson interactions and accepted prior evidence.","estimated_minutes":45,"starting_state":{"entry_point":"lessons/09_train_and_evaluate_a_neural_network/index.html#ai-story","requirements":["Modern web browser","Accepted increment before P2-I04"],"known_good_state":"The lesson interactions load and the prior contract is available.","compose_profile":null},"learner_decisions":["Split policy","Checkpoint selection","Release evidence"],"levels":{"guided":{"objective":"Complete the supported activity path and record observable evidence.","steps":["Define split boundaries","Choose stopping and checkpoint rules","Review one error slice"],"expected_observation":"The selected model has protected and reproducible evidence."},"challenge":{"objective":"Compare seeds and issue a release, revise, or reject decision.","steps":["Predict the result before changing the scenario","Run the failure comparison","Record evidence and recovery"],"expected_observation":"Seed and slice evidence reveal stability beyond one score."},"engineer_extension":{"objective":"Add lineage, intervals, tolerances, and rollback criteria.","steps":["Define the production constraint","Add operational evidence","Document rollback behavior"],"expected_observation":"An independent reviewer can reproduce the decision.","optional":true}},"failure_experiment":{"change":"Split repeated entities randomly","prediction":"Validation becomes overoptimistic","failure_signal":"Same entity appears across boundaries","recovery":"Group the split and rerun"},"evidence":["Dataset identity","Split identity","Run lineage","Curves","Checkpoint","Slices","Decision"],"artifact":{"name":"Create a reproducible model release packet","format":"markdown","path_or_download":"L09-A1-release-packet.md","fields":["dataset_identity","split_identity","run_lineage","curves","checkpoint","slices","decision"]},"acceptance_criteria":["The selected model has protected and reproducible evidence.","Seed and slice evidence reveal stability beyond one score.","The artifact identifies its downstream consumer and recovery behavior."],"recovery":["Group the split and rerun","Return to the lesson's known-good scenario before comparing another change."],"phase_increment":"P2-I04"}
