{"schema_version":"1.0","activity_id":"L08-A1","lesson":8,"title":"Design a framework execution and checkpoint contract","mission":"Design a framework execution and checkpoint contract using the lesson interactions and accepted prior evidence.","estimated_minutes":45,"starting_state":{"entry_point":"lessons/08_pytorch_and_autograd/index.html#ai-story","requirements":["Modern web browser","Accepted increment before P2-I03"],"known_good_state":"The lesson interactions load and the prior contract is available.","compose_profile":null},"learner_decisions":["State ownership","Lifecycle order","Checkpoint fields"],"levels":{"guided":{"objective":"Complete the supported activity path and record observable evidence.","steps":["Map state to owners","Order a training step","Order an evaluation step"],"expected_observation":"Training and evaluation preserve distinct state behavior."},"challenge":{"objective":"Predict stale-gradient and wrong-mode failures.","steps":["Predict the result before changing the scenario","Run the failure comparison","Record evidence and recovery"],"expected_observation":"State changes despite plausible outputs."},"engineer_extension":{"objective":"Add dtype, device, compatibility, and rollback policy.","steps":["Define the production constraint","Add operational evidence","Document rollback behavior"],"expected_observation":"Checkpoint meaning remains portable across runtime changes.","optional":true}},"failure_experiment":{"change":"Use evaluation in training mode","prediction":"Outputs become stochastic or buffers change","failure_signal":"Repeated evaluation changes behavior","recovery":"Set evaluation mode and rerun unchanged inputs"},"evidence":["State map","Training order","Evaluation order","Checkpoint manifest","Recovery"],"artifact":{"name":"Design a framework execution and checkpoint contract","format":"markdown","path_or_download":"L08-A1-framework-state-contract.md","fields":["state_map","training_order","evaluation_order","checkpoint_manifest","recovery"]},"acceptance_criteria":["Training and evaluation preserve distinct state behavior.","State changes despite plausible outputs.","The artifact identifies its downstream consumer and recovery behavior."],"recovery":["Set evaluation mode and rerun unchanged inputs","Return to the lesson's known-good scenario before comparing another change."],"phase_increment":"P2-I03"}
